{
  "$schema": "https://json-schema.org/draft/2020-12/schema",
  "$id": "clearlane.envelope/v1",
  "title": "Clearlane hourly operating envelope, v1",
  "description": "Mirrors the Envelope interface in contracts/types.ts. Times are UTC interval starts ending in Z; Mountain time is display only.",
  "type": "object",
  "required": [
    "schema",
    "operating_day_mt",
    "fleet_kw",
    "sch_rule",
    "hours",
    "generated_utc"
  ],
  "additionalProperties": false,
  "properties": {
    "schema": { "const": "clearlane.envelope/v1" },
    "operating_day_mt": {
      "type": "string",
      "pattern": "^\\d{4}-\\d{2}-\\d{2}$"
    },
    "fleet_kw": { "type": "number", "minimum": 0 },
    "sch_rule": {
      "type": "string",
      "description": "Our proposed System Critical Hours rule, stated in words."
    },
    "generated_utc": {
      "type": "string",
      "pattern": "^\\d{4}-\\d{2}-\\d{2}T\\d{2}:\\d{2}:\\d{2}(\\.\\d+)?Z$"
    },
    "hours": {
      "type": "array",
      "minItems": 24,
      "maxItems": 24,
      "items": {
        "type": "object",
        "required": [
          "ts_utc",
          "system_critical",
          "reserve_kw",
          "max_charge_kw",
          "max_discharge_kw",
          "planned_kw",
          "reason"
        ],
        "additionalProperties": false,
        "properties": {
          "ts_utc": {
            "type": "string",
            "pattern": "^\\d{4}-\\d{2}-\\d{2}T\\d{2}:\\d{2}:\\d{2}Z$"
          },
          "system_critical": { "type": "boolean" },
          "reserve_kw": {
            "type": "number",
            "minimum": 0,
            "description": "Fleet power held for RMP calls."
          },
          "max_charge_kw": {
            "type": "number",
            "minimum": 0,
            "description": "Fleet charge limit after host ceilings."
          },
          "max_discharge_kw": { "type": "number", "minimum": 0 },
          "planned_kw": {
            "type": "number",
            "description": "Fleet planned net: + charge, - discharge."
          },
          "reason": {
            "type": "string",
            "description": "Plain words, e.g. top 4 net-load hour."
          }
        }
      }
    }
  }
}
